{
  "$schema": "https://json-schema.org/draft/2020-12/schema",
  "$id": "https://flowfoundry.dev/schemas/decision-ledger.schema.json",
  "title": "FlowFoundry Decision Ledger",
  "type": "object",
  "additionalProperties": false,
  "required": ["schema_version", "generated_at", "candidate_base", "decisions"],
  "properties": {
    "schema_version": {"const": 1},
    "generated_at": {"type": "string", "format": "date-time"},
    "candidate_base": {"type": "string", "pattern": "^[0-9a-f]{40}$"},
    "decisions": {
      "type": "array",
      "items": {
        "type": "object",
        "additionalProperties": false,
        "required": [
          "decision_id", "domain", "date", "decision", "status", "authority",
          "participants", "originating_contribution", "meeting_id", "round",
          "human_gate", "evidence", "current_surface", "implementation_status",
          "superseded_by", "notes"
        ],
        "properties": {
          "decision_id": {"type": "string", "pattern": "^FF-[A-Z]+-[0-9]{3}$"},
          "domain": {"enum": ["PRODUCT", "BRAND", "RUNTIME", "UX", "RELEASE", "FUTURE", "ARCHITECTURE"]},
          "date": {"type": "string", "format": "date"},
          "decision": {"type": "string", "minLength": 1},
          "status": {"enum": ["BINDING", "ADOPTED", "ADVISORY", "OPEN", "SUPERSEDED", "LOST", "CONFLICTING", "NEEDS_HUMAN_REVIEW"]},
          "authority": {"type": "string", "minLength": 1},
          "participants": {"type": "array", "items": {"type": "string"}, "minItems": 1},
          "originating_contribution": {"type": ["string", "object"]},
          "meeting_id": {"type": ["string", "null"]},
          "round": {"type": ["string", "integer", "null"]},
          "human_gate": {
            "type": "object",
            "additionalProperties": false,
            "required": ["status", "evidence"],
            "properties": {
              "status": {"enum": ["APPROVED", "NOT_RECORDED", "NOT_REQUIRED", "PENDING"]},
              "evidence": {"type": ["string", "null"]}
            }
          },
          "evidence": {"type": "array", "items": {"type": "string"}, "minItems": 1},
          "current_surface": {"type": "array", "items": {"type": "string"}},
          "implementation_status": {"type": "string"},
          "superseded_by": {"type": ["string", "null"]},
          "notes": {"type": "string"}
        }
      }
    }
  }
}
