{
  "schema_version": 1,
  "generated_at": "2026-08-27T00:00:00+08:00",
  "candidate_base": "e9692132c20285b348b261d3483c9ae04cfd362e",
  "decisions": [
    {
      "decision_id": "FF-PRODUCT-001",
      "domain": "PRODUCT",
      "date": "2026-08-12",
      "decision": "Keep the official product name FlowFoundry.",
      "status": "BINDING",
      "authority": "Completed cross-provider Brand Council convergence",
      "participants": ["Codex", "DeepSeek"],
      "originating_contribution": "Both providers independently selected KEEP FLOWFOUNDRY; Codex emphasized exact runtime fit and migration threshold, while DeepSeek added the industrial-metaphor, developer-credibility, poster, and bounded alternative analysis.",
      "meeting_id": "first-real-cross-provider-brand-council-live-1",
      "round": 1,
      "human_gate": {"status": "NOT_RECORDED", "evidence": null},
      "evidence": [
        ".flowfoundry/runs/first-real-cross-provider-brand-council-live-1/final/meeting-result.json",
        ".flowfoundry/runs/first-real-cross-provider-brand-council-live-1/tasks/codex-brand-view/result.json",
        ".flowfoundry/runs/first-real-cross-provider-brand-council-live-1/tasks/deepseek-brand-view/result.json"
      ],
      "current_surface": ["README.md", "docs/POSITIONING.md", "package and CLI naming"],
      "implementation_status": "Implemented and present.",
      "superseded_by": null,
      "notes": "The Meeting input expressly requested a binding decision, but no separate post-Meeting Human Gate receipt was found. Continued official use is strong adoption evidence."
    },
    {
      "decision_id": "FF-PRODUCT-002",
      "domain": "PRODUCT",
      "date": "2026-08-12",
      "decision": "Use Local-first Adaptive AI Team Runtime as the product category.",
      "status": "BINDING",
      "authority": "Fixed input to the binding Visual Identity Council and preserved product-state records",
      "participants": ["Human sponsor", "Codex", "DeepSeek"],
      "originating_contribution": "The category entered the Visual Identity Council as a fixed previous decision, not a new provider proposal.",
      "meeting_id": "visual-identity-council-live-1",
      "round": "prior binding input",
      "human_gate": {"status": "NOT_RECORDED", "evidence": null},
      "evidence": [
        ".flowfoundry/runs/_inputs/visual-identity-council-live-1.json",
        ".flowfoundry/runs/visual-identity-council-live-1/artifacts/meeting/context-pack.json",
        ".flowfoundry/rc-archives/pre-codex-a65de2a/handoff/CODEX_HANDOFF.md"
      ],
      "current_surface": ["README.md uses local-first AI coordination layer instead", "docs/CURRENT_STATUS.md uses coordination runtime"],
      "implementation_status": "Runtime still supports the category claim; exact category wording was lost from the GitHub first screen.",
      "superseded_by": null,
      "notes": "AI Coordination Layer is a useful stage/mechanism label, but no later binding evidence authorizes it to replace the official category."
    },
    {
      "decision_id": "FF-PRODUCT-003",
      "domain": "PRODUCT",
      "date": "2026-08-12",
      "decision": "The core principle is the smallest sufficient Agent or Team: if one Agent is sufficient, do not use two; if two suffice, do not use five.",
      "status": "BINDING",
      "authority": "Fixed cross-provider Meeting input plus implemented runtime policy",
      "participants": ["Human sponsor", "Codex", "DeepSeek"],
      "originating_contribution": "The principle predated the identity meetings and was treated as binding by both providers.",
      "meeting_id": "visual-identity-council-live-1",
      "round": "prior binding input",
      "human_gate": {"status": "NOT_RECORDED", "evidence": null},
      "evidence": [
        ".flowfoundry/runs/_inputs/brand-council-live-1.json",
        ".flowfoundry/runs/_inputs/visual-identity-council-live-1.json",
        "docs/ARCHITECTURE.md",
        "src/flowfoundry/orchestration/intelligence.py"
      ],
      "current_surface": ["README.md minimum-sufficient sentence", "docs/ARCHITECTURE.md", "docs/POSITIONING.md"],
      "implementation_status": "Implemented and documented, but weakened in the GitHub hero.",
      "superseded_by": null,
      "notes": "This principle governs both agent/team sizing and the broader minimum execution path."
    },
    {
      "decision_id": "FF-PRODUCT-004",
      "domain": "PRODUCT",
      "date": "2026-08-12",
      "decision": "Use the primary English tagline: One goal. The smallest sufficient AI team.",
      "status": "BINDING",
      "authority": "Completed Visual Identity Council convergence",
      "participants": ["Codex", "DeepSeek"],
      "originating_contribution": "Both providers independently selected the same tagline and defended it as the durable expression of the core principle.",
      "meeting_id": "visual-identity-council-live-1",
      "round": 1,
      "human_gate": {"status": "NOT_RECORDED", "evidence": null},
      "evidence": [
        ".flowfoundry/runs/visual-identity-council-live-1/final/meeting-result.json",
        ".flowfoundry/runs/visual-identity-council-live-1/tasks/codex-visual-view/result.json",
        ".flowfoundry/runs/visual-identity-council-live-1/tasks/deepseek-visual-view/result.json"
      ],
      "current_surface": ["Absent from e969213 README hero", "preserved in ignored historical design artifacts"],
      "implementation_status": "Historically adopted; silently lost from the current GitHub first screen.",
      "superseded_by": null,
      "notes": "The newer sentence about coordinated systems is a launch insight, not evidence of tagline supersession."
    },
    {
      "decision_id": "FF-PRODUCT-005",
      "domain": "PRODUCT",
      "date": "2026-08-12",
      "decision": "Use the Chinese campus headline: 你定目标，AI组队实现.",
      "status": "BINDING",
      "authority": "Targeted Round 2 convergence with no remaining dissent",
      "participants": ["DeepSeek", "Codex"],
      "originating_contribution": "DeepSeek originated the headline in Round 1. Codex initially proposed 一个目标，刚好够用的AI小队, then revised to DeepSeek's wording after bounded cross-review.",
      "meeting_id": "visual-identity-council-live-1",
      "round": 2,
      "human_gate": {"status": "NOT_RECORDED", "evidence": null},
      "evidence": [
        ".flowfoundry/runs/visual-identity-council-live-1/artifacts/meeting/conflicts/conflict-001.json",
        ".flowfoundry/runs/visual-identity-council-live-1/artifacts/meeting/round2/cross-conflict-001-codex-visual-view/provider-output.json",
        ".flowfoundry/runs/visual-identity-council-live-1/final/meeting-result.json"
      ],
      "current_surface": ["Absent from public candidate", "present in campus-poster and historical logo prototypes"],
      "implementation_status": "Historically adopted; lost from current brand guidance and campus-facing product surface.",
      "superseded_by": null,
      "notes": "This is the clearest verified example of a material DeepSeek contribution changing the final shared result."
    },
    {
      "decision_id": "FF-PRODUCT-006",
      "domain": "PRODUCT",
      "date": "2026-08-12",
      "decision": "Choose one canonical plain-Chinese explanatory sentence to accompany the campus headline.",
      "status": "OPEN",
      "authority": "Meeting requirement without a single exact converged sentence",
      "participants": ["Codex", "DeepSeek"],
      "originating_contribution": "Both providers supplied useful but different Chinese explanations; the compact final convergence record selected the headline, tagline, and logo direction but did not preserve one exact explanatory sentence.",
      "meeting_id": "visual-identity-council-live-1",
      "round": 2,
      "human_gate": {"status": "PENDING", "evidence": "docs/HUMAN_DECISION_QUEUE.md"},
      "evidence": [
        ".flowfoundry/runs/visual-identity-council-live-1/tasks/deepseek-visual-view/result.json",
        ".flowfoundry/runs/visual-identity-council-live-1/artifacts/meeting/round2/cross-conflict-001-codex-visual-view/provider-output.json",
        ".flowfoundry/runs/visual-identity-council-live-1/final/meeting-result.json"
      ],
      "current_surface": ["No canonical Chinese explanation in public candidate"],
      "implementation_status": "Not implemented as canonical copy.",
      "superseded_by": null,
      "notes": "Do not silently promote either provider's exact sentence."
    },
    {
      "decision_id": "FF-PRODUCT-007",
      "domain": "PRODUCT",
      "date": "2026-08-25",
      "decision": "Use AI Coordination Layer as the current-stage explanatory layer, not as a replacement for the official category.",
      "status": "ADOPTED",
      "authority": "Later productization documents reconciled with earlier binding category",
      "participants": ["Codex productization"],
      "originating_contribution": "Later productization made the current runtime easier to explain and separated current, next, and future product stages.",
      "meeting_id": null,
      "round": null,
      "human_gate": {"status": "NOT_RECORDED", "evidence": null},
      "evidence": ["README.md", "docs/PRODUCT_ROADMAP.md", "docs/FLOWFOUNDRY_PRODUCT_ARCHITECTURE.md"],
      "current_surface": ["README.md", "docs/PRODUCT_ROADMAP.md"],
      "implementation_status": "Present, but currently occupies the category slot in the hero.",
      "superseded_by": null,
      "notes": "Correct hierarchy: category = Local-first Adaptive AI Team Runtime; current stage/explanation = local-first AI coordination layer."
    },
    {
      "decision_id": "FF-PRODUCT-008",
      "domain": "PRODUCT",
      "date": "2026-08-25",
      "decision": "Use AI is moving from individual models to coordinated systems as launch-story framing, not as the primary brand tagline.",
      "status": "ADVISORY",
      "authority": "Later marketing/productization proposal",
      "participants": ["Codex productization"],